{
  "schemaVersion": 1,
  "projectId": "ium-lernwerk",
  "asOf": "2026-09-05",
  "scope": {
    "grades": [
      5,
      6,
      7
    ],
    "schoolType": "Gymnasium Baden-Württemberg",
    "level": "E",
    "maturity": "working",
    "contentProduction": "frozen",
    "productBinding": "product-neutral"
  },
  "reviewBoundary": {
    "definitionStatus": "working",
    "executionStatus": "not-run",
    "pilot": "not-started",
    "standardAllowed": false,
    "learningEffectClaimAllowed": false,
    "personalTelemetryAllowed": false
  },
  "gates": [
    {
      "id": "evidence-integrity",
      "title": "Evidenz und Geltungsgrenzen",
      "question": "Welche registrierte Quelle trägt über einen begrenzten Claim und ein freigegebenes Prinzip die jeweilige Gestaltungsentscheidung?",
      "evidenceRequired": [
        "Quellen-ID, Claim-ID, Prinzip-ID und konkrete Fundstelle mit überprüftem Geltungsbereich.",
        "Dokumentierte Trennung von empirischem Claim, professioneller Guidance und Projektentscheidung; offene Übertragungsfragen."
      ],
      "method": [
        "source-review",
        "expert-review",
        "automated-check"
      ],
      "principleIds": [
        "LXF04-PR-001",
        "LXF04-PR-004",
        "LXF04-PR-009",
        "LXF04-PR-017"
      ],
      "patternIds": [
        "LXF05-PT-001",
        "LXF05-PT-002",
        "LXF05-PT-003"
      ],
      "passCondition": "Jede tragende Aussage ist ohne Referenzlücke rückverfolgbar; Geltungsbereich und Randbedingungen passen zur Entscheidung. Guidance und technische Tests werden nicht als kausaler Wirkungsnachweis verwendet.",
      "failAction": "Pflichtlücke schließen oder Aussage begründet zurücknehmen; bis zum erneuten Quellenreview keine Fundamentfreigabe. Optionale historische Lücken als solche kennzeichnen.",
      "ownerRole": "source-reviewer",
      "statusEffect": {
        "onPass": "eligible-for-lxf07-review",
        "onFail": "block-foundation-review",
        "pilot": "not-started",
        "standardAllowed": false
      }
    },
    {
      "id": "goal-action-evidence-alignment",
      "title": "Ziel, Handlung und Nachweis",
      "question": "Erzeugt die zentrale Lernhandlung ein Produkt, an dem genau der fachliche Zielzustand beurteilt werden kann?",
      "evidenceRequired": [
        "Gegenüberstellung von Zielzustand, Handlung, Produkt und Kriterien im neutralen Lernbogen.",
        "Begründete Anschlussoptionen für unterschiedliche Produktlagen."
      ],
      "method": [
        "expert-review",
        "content-walkthrough"
      ],
      "principleIds": [
        "LXF04-PR-001",
        "LXF04-PR-002",
        "LXF04-PR-003"
      ],
      "patternIds": [
        "LXF05-PT-001",
        "LXF05-PT-004",
        "LXF05-PT-006"
      ],
      "passCondition": "Ziel, Handlung und Produkt betreffen dieselbe fachliche Beziehung; Kriterien erfassen die Eigenleistung und keine bloße Bedienung. Abweichende Produktlagen führen zu fachlich begründeten Anschlussoptionen.",
      "failAction": "Ziel-Handlungs-Produkt-Kette vor weiterer Ausgestaltung korrigieren; betreffenden Lernbogen erneut fachlich prüfen.",
      "ownerRole": "subject-didactics-reviewer",
      "statusEffect": {
        "onPass": "eligible-for-lxf07-review",
        "onFail": "block-foundation-review",
        "pilot": "not-started",
        "standardAllowed": false
      }
    },
    {
      "id": "cognitive-economy",
      "title": "Fachliche Verarbeitung und vermeidbare Nebenlast",
      "question": "Halten Gliederung und Informationshierarchie die notwendige Denkarbeit erreichbar, ohne Such- und Bedienlast hinzuzufügen?",
      "evidenceRequired": [
        "Begründete fachliche Segmente, Informationshierarchie und Zuordnungen im neutralen Walkthrough.",
        "Beschriebene mögliche Sprach-, Such- und Bedienhürden sowie Bedingungen für stärkere Führung."
      ],
      "method": [
        "expert-review",
        "content-walkthrough"
      ],
      "principleIds": [
        "LXF04-PR-004",
        "LXF04-PR-008",
        "LXF04-PR-016"
      ],
      "patternIds": [
        "LXF05-PT-001",
        "LXF05-PT-003",
        "LXF05-PT-009"
      ],
      "passCondition": "Jede Unterteilung und Hervorhebung dient einer benennbaren fachlichen Beziehung. Nötige Information bleibt zugänglich; es gibt keine unbelegte Alters-, Seiten-, Element- oder Minutenregel.",
      "failAction": "Nebenlast und versteckte Zuordnungen beseitigen, ohne Ziel oder Kernhandlung zu vereinfachen; offene reale Nutzbarkeit später gesondert prüfen.",
      "ownerRole": "subject-didactics-reviewer",
      "statusEffect": {
        "onPass": "eligible-for-lxf07-review",
        "onFail": "block-foundation-review",
        "pilot": "not-started",
        "standardAllowed": false
      }
    },
    {
      "id": "disciplinary-learning-action",
      "title": "Fachliche Eigenleistung",
      "question": "Welche Beziehung wird erklärt, konstruiert, ausgeführt, geprüft oder begründet und wo wird die Eigenleistung sichtbar?",
      "evidenceRequired": [
        "Benannte Kernhandlung und interpretierbares Zwischen- oder Lernprodukt.",
        "Begründete Wahl zwischen Modellierung, unterstützter Exploration und eigenständiger Anwendung; Anschluss an Vorwissen."
      ],
      "method": [
        "expert-review",
        "content-walkthrough"
      ],
      "principleIds": [
        "LXF04-PR-005",
        "LXF04-PR-006",
        "LXF04-PR-007",
        "LXF04-PR-009",
        "LXF04-PR-013"
      ],
      "patternIds": [
        "LXF05-PT-002",
        "LXF05-PT-004",
        "LXF05-PT-008"
      ],
      "passCondition": "Beispiel, Exploration und eigene Anwendung sind funktional unterschieden. Eine selbst erzeugte Erklärung, Ausführung, Begründung oder Revision trägt den Nachweis; bloße Aktivität und Methodenlabels reichen nicht.",
      "failAction": "Kernhandlung und eigene Anwendung ergänzen oder neu entwerfen; bei fehlendem Anschlusswissen Modellierung vorsehen statt unbegründeter Exploration.",
      "ownerRole": "subject-didactics-reviewer",
      "statusEffect": {
        "onPass": "eligible-for-lxf07-review",
        "onFail": "block-foundation-review",
        "pilot": "not-started",
        "standardAllowed": false
      }
    },
    {
      "id": "representation-coherence",
      "title": "Kohärente Repräsentationen",
      "question": "Beziehen sich Material, Begriffe, Signale und Zustände nachvollziehbar auf dieselbe fachliche Beziehung?",
      "evidenceRequired": [
        "Zuordnung zusammengehöriger Begriffe, Zustände und Repräsentationen samt nicht ausschließlich farblicher Kennzeichnung.",
        "Prüfbarer Vergleich von Ausgangs-, Ausführungs- und Ergebniszustand sowie Alternativdarstellung."
      ],
      "method": [
        "expert-review",
        "content-walkthrough"
      ],
      "principleIds": [
        "LXF04-PR-004",
        "LXF04-PR-006",
        "LXF04-PR-008",
        "LXF04-PR-017"
      ],
      "patternIds": [
        "LXF05-PT-003",
        "LXF05-PT-004",
        "LXF05-PT-010"
      ],
      "passCondition": "Bezeichnungen und Zustände sind konsistent; jede Darstellung und jedes Signal hat eine Lernfunktion. Zeitliche Veränderungen bleiben schrittweise oder statisch nachvollziehbar.",
      "failAction": "Widersprüchliche Zustände, dekorative Darstellungen und unauflösbare Referenzen korrigieren; anschließend fachlichen Zuordnungsreview wiederholen.",
      "ownerRole": "subject-didactics-reviewer",
      "statusEffect": {
        "onPass": "eligible-for-lxf07-review",
        "onFail": "block-foundation-review",
        "pilot": "not-started",
        "standardAllowed": false
      }
    },
    {
      "id": "support-without-task-removal",
      "title": "Hilfe mit erhaltener Kernhandlung",
      "question": "Adressiert die Hilfe eine erkennbare Hürde und führt sie zu einem eigenen fachlichen Schritt zurück?",
      "evidenceRequired": [
        "Hürde, Auslöser, Unterstützungsform, Rücknahmepunkt und erwartetes Produkt nach Hilfe.",
        "Unterscheidung von vollständiger Modellierung und Hilfe innerhalb eigenständiger Anwendung."
      ],
      "method": [
        "expert-review",
        "content-walkthrough"
      ],
      "principleIds": [
        "LXF04-PR-010",
        "LXF04-PR-011",
        "LXF04-PR-013"
      ],
      "patternIds": [
        "LXF05-PT-002",
        "LXF05-PT-005",
        "LXF05-PT-010"
      ],
      "passCondition": "Hilfe beseitigt eine Zugangs- oder Bearbeitungshürde, ohne den nachzuweisenden Kernschritt zu lösen. Rücknahme folgt sichtbarer Bewältigung; Lern- und Leistungsaufgabe bleiben getrennt.",
      "failAction": "Hilfekette auf die Hürde begrenzen und eigene Anschlussleistung wiederherstellen; fehlende Voraussetzung durch ausdrücklichen Wechsel zur Modellierung behandeln.",
      "ownerRole": "subject-didactics-reviewer",
      "statusEffect": {
        "onPass": "eligible-for-lxf07-review",
        "onFail": "block-foundation-review",
        "pilot": "not-started",
        "standardAllowed": false
      }
    },
    {
      "id": "feedback-and-next-action",
      "title": "Rückmeldung, Abruf und Weiterarbeit",
      "question": "Eröffnet Rückmeldung einen fachlich überprüfbaren nächsten Schritt, für den tatsächlich Weiterarbeit vorgesehen ist?",
      "evidenceRequired": [
        "Kriterium, konkrete Produktstelle, Rückmeldung sowie Ausgangs- und Revisionsstand.",
        "Gesonderte Nachweisbedingungen für unmittelbare Anwendung, verzögerten Abruf und Transfer; vorgesehene Zeit für Feedbacknutzung."
      ],
      "method": [
        "expert-review",
        "content-walkthrough"
      ],
      "principleIds": [
        "LXF04-PR-010",
        "LXF04-PR-012",
        "LXF04-PR-013",
        "LXF04-PR-014",
        "LXF04-PR-015"
      ],
      "patternIds": [
        "LXF05-PT-006",
        "LXF05-PT-007",
        "LXF05-PT-008"
      ],